{"$schema":"https://json-schema.org/draft/2020-12/schema","$id":"brainon/model-bundle/v1","type":"object","required":["model_id","model_version","artifact_uri","checksum","framework","input_modalities","input_shape","preprocessing_version","postprocessing_version","output_type","created_at"],"properties":{"model_id":{"type":"string"},"model_version":{"type":"string"},"artifact_uri":{"type":"string","pattern":"^(gs|https)://"},"checksum":{"type":"string","pattern":"^sha256:[a-fA-F0-9]{64}$"},"framework":{"type":"string"},"input_modalities":{"type":"array","minItems":1,"items":{"enum":["CT","MRI","MRA"]}},"input_shape":{"type":"array","items":{"type":"integer","minimum":1}},"preprocessing_version":{"type":"string"},"postprocessing_version":{"type":"string"},"output_type":{"type":"array","items":{"enum":["DICOM_SEG","DICOM_SR"]}},"created_at":{"type":"string","format":"date-time"}},"additionalProperties":false}
