{"model_id":"synthetic-placeholder","model_version":"0.0.0","artifact_uri":"gs://TODO_BUCKET/models/TODO","checksum":"sha256:0000000000000000000000000000000000000000000000000000000000000000","framework":"TODO","input_modalities":["CT"],"input_shape":[1,1,1],"preprocessing_version":"TODO","postprocessing_version":"TODO","output_type":["DICOM_SEG","DICOM_SR"],"created_at":"2026-01-01T00:00:00Z"}
